{
  "schema_version": "2.0.0",
  "run_id": "RUN-BARGE-001",
  "case_id": "BARGE-001",
  "case_version": "2.0.0",
  "attempt": 1,
  "execution_kind": "synthetic",
  "time_base": {
    "kind": "run_monotonic_ms",
    "origin": "Synthetic zero; not a wall clock or hardware capture"
  },
  "run_snapshot": {
    "device": "fixture",
    "hardware": "fixture",
    "firmware": "fixture",
    "model": "fixture",
    "prompt": "fixture",
    "environment": "fixture",
    "test_assets": {
      "golden_set_id": null,
      "golden_set_version": null,
      "case_sha256": "0000000000000000000000000000000000000000000000000000000000000000",
      "asset_sha256": {}
    }
  },
  "status": "complete",
  "gaps": [],
  "tracks": [
    {
      "track_id": "stimulus",
      "role": "stimulus",
      "clock_id": "fixture-clock",
      "sample_rate_hz": 16000,
      "sync": {
        "status": "synthetic",
        "offset_ms": 0,
        "uncertainty_ms": 0,
        "max_drift_ppm": 0,
        "calibration_id": "fixture-not-measured"
      }
    },
    {
      "track_id": "device_output",
      "role": "device_output",
      "clock_id": "fixture-clock",
      "sample_rate_hz": 16000,
      "sync": {
        "status": "synthetic",
        "offset_ms": 0,
        "uncertainty_ms": 0,
        "max_drift_ppm": 0,
        "calibration_id": "fixture-not-measured"
      }
    }
  ],
  "artifacts": [
    {
      "artifact_id": "ART-stimulus",
      "kind": "audio",
      "path": "fixtures/stimulus.wav",
      "sha256": "0000000000000000000000000000000000000000000000000000000000000000",
      "origin": "synthetic",
      "track_id": "stimulus",
      "duration_ms": 20000
    },
    {
      "artifact_id": "ART-device_output",
      "kind": "audio",
      "path": "fixtures/device_output.wav",
      "sha256": "0000000000000000000000000000000000000000000000000000000000000000",
      "origin": "synthetic",
      "track_id": "device_output",
      "duration_ms": 20000
    }
  ],
  "evidence": [
    {
      "schema_version": "1.0.0",
      "evidence_id": "EVD-EVT-001",
      "artifact_id": "ART-stimulus",
      "track_id": "stimulus",
      "time_base": "run_monotonic_ms",
      "start_ms": 0,
      "end_ms": 0,
      "source": "manual_annotation",
      "confidence": 0.9
    },
    {
      "schema_version": "1.0.0",
      "evidence_id": "EVD-EVT-002",
      "artifact_id": "ART-stimulus",
      "track_id": "stimulus",
      "time_base": "run_monotonic_ms",
      "start_ms": 1000,
      "end_ms": 1000,
      "source": "manual_annotation",
      "confidence": 0.9
    },
    {
      "schema_version": "1.0.0",
      "evidence_id": "EVD-EVT-003",
      "artifact_id": "ART-device_output",
      "track_id": "device_output",
      "time_base": "run_monotonic_ms",
      "start_ms": 2000,
      "end_ms": 2000,
      "source": "manual_annotation",
      "confidence": 0.9
    },
    {
      "schema_version": "1.0.0",
      "evidence_id": "EVD-EVT-004",
      "artifact_id": "ART-stimulus",
      "track_id": "stimulus",
      "time_base": "run_monotonic_ms",
      "start_ms": 2500,
      "end_ms": 2500,
      "source": "manual_annotation",
      "confidence": 0.9
    },
    {
      "schema_version": "1.0.0",
      "evidence_id": "EVD-EVT-005",
      "artifact_id": "ART-stimulus",
      "track_id": "stimulus",
      "time_base": "run_monotonic_ms",
      "start_ms": 2500,
      "end_ms": 2500,
      "source": "manual_annotation",
      "confidence": 0.9
    },
    {
      "schema_version": "1.0.0",
      "evidence_id": "EVD-EVT-006",
      "artifact_id": "ART-device_output",
      "track_id": "device_output",
      "time_base": "run_monotonic_ms",
      "start_ms": 2700,
      "end_ms": 2700,
      "source": "manual_annotation",
      "confidence": 0.9
    },
    {
      "schema_version": "1.0.0",
      "evidence_id": "EVD-EVT-007",
      "artifact_id": "ART-stimulus",
      "track_id": "stimulus",
      "time_base": "run_monotonic_ms",
      "start_ms": 3300,
      "end_ms": 3300,
      "source": "manual_annotation",
      "confidence": 0.9
    },
    {
      "schema_version": "1.0.0",
      "evidence_id": "EVD-EVT-008",
      "artifact_id": "ART-stimulus",
      "track_id": "stimulus",
      "time_base": "run_monotonic_ms",
      "start_ms": 3300,
      "end_ms": 3300,
      "source": "manual_annotation",
      "confidence": 0.9
    },
    {
      "schema_version": "1.0.0",
      "evidence_id": "EVD-EVT-009",
      "artifact_id": "ART-device_output",
      "track_id": "device_output",
      "time_base": "run_monotonic_ms",
      "start_ms": 3900,
      "end_ms": 3900,
      "source": "manual_annotation",
      "confidence": 0.9
    },
    {
      "schema_version": "1.0.0",
      "evidence_id": "EVD-EVT-010",
      "artifact_id": "ART-device_output",
      "track_id": "device_output",
      "time_base": "run_monotonic_ms",
      "start_ms": 5100,
      "end_ms": 5100,
      "source": "manual_annotation",
      "confidence": 0.9
    }
  ],
  "events": [
    {
      "schema_version": "2.0.0",
      "event_id": "EVT-001",
      "run_id": "RUN-BARGE-001",
      "case_id": "BARGE-001",
      "turn_id": "turn_1",
      "response_id": null,
      "type": "tester_speech_start",
      "start_ms": 0,
      "end_ms": 0,
      "source": "manual_annotation",
      "observation_scope": "black_box",
      "confidence": 0.9,
      "evidence_ids": [
        "EVD-EVT-001"
      ]
    },
    {
      "schema_version": "2.0.0",
      "event_id": "EVT-002",
      "run_id": "RUN-BARGE-001",
      "case_id": "BARGE-001",
      "turn_id": "turn_1",
      "response_id": null,
      "type": "tester_speech_end",
      "start_ms": 1000,
      "end_ms": 1000,
      "source": "manual_annotation",
      "observation_scope": "black_box",
      "confidence": 0.9,
      "evidence_ids": [
        "EVD-EVT-002"
      ]
    },
    {
      "schema_version": "2.0.0",
      "event_id": "EVT-003",
      "run_id": "RUN-BARGE-001",
      "case_id": "BARGE-001",
      "turn_id": "turn_1",
      "response_id": "old",
      "type": "device_speech_start",
      "start_ms": 2000,
      "end_ms": 2000,
      "source": "manual_annotation",
      "observation_scope": "black_box",
      "confidence": 0.9,
      "evidence_ids": [
        "EVD-EVT-003"
      ]
    },
    {
      "schema_version": "2.0.0",
      "event_id": "EVT-004",
      "run_id": "RUN-BARGE-001",
      "case_id": "BARGE-001",
      "turn_id": "turn_2",
      "response_id": null,
      "type": "interrupt_start",
      "start_ms": 2500,
      "end_ms": 2500,
      "source": "manual_annotation",
      "observation_scope": "black_box",
      "confidence": 0.9,
      "evidence_ids": [
        "EVD-EVT-004"
      ]
    },
    {
      "schema_version": "2.0.0",
      "event_id": "EVT-005",
      "run_id": "RUN-BARGE-001",
      "case_id": "BARGE-001",
      "turn_id": "turn_2",
      "response_id": null,
      "type": "tester_speech_start",
      "start_ms": 2500,
      "end_ms": 2500,
      "source": "manual_annotation",
      "observation_scope": "black_box",
      "confidence": 0.9,
      "evidence_ids": [
        "EVD-EVT-005"
      ]
    },
    {
      "schema_version": "2.0.0",
      "event_id": "EVT-006",
      "run_id": "RUN-BARGE-001",
      "case_id": "BARGE-001",
      "turn_id": "turn_1",
      "response_id": "old",
      "type": "device_speech_end",
      "start_ms": 2700,
      "end_ms": 2700,
      "source": "manual_annotation",
      "observation_scope": "black_box",
      "confidence": 0.9,
      "evidence_ids": [
        "EVD-EVT-006"
      ]
    },
    {
      "schema_version": "2.0.0",
      "event_id": "EVT-007",
      "run_id": "RUN-BARGE-001",
      "case_id": "BARGE-001",
      "turn_id": "turn_2",
      "response_id": null,
      "type": "interrupt_end",
      "start_ms": 3300,
      "end_ms": 3300,
      "source": "manual_annotation",
      "observation_scope": "black_box",
      "confidence": 0.9,
      "evidence_ids": [
        "EVD-EVT-007"
      ]
    },
    {
      "schema_version": "2.0.0",
      "event_id": "EVT-008",
      "run_id": "RUN-BARGE-001",
      "case_id": "BARGE-001",
      "turn_id": "turn_2",
      "response_id": null,
      "type": "tester_speech_end",
      "start_ms": 3300,
      "end_ms": 3300,
      "source": "manual_annotation",
      "observation_scope": "black_box",
      "confidence": 0.9,
      "evidence_ids": [
        "EVD-EVT-008"
      ]
    },
    {
      "schema_version": "2.0.0",
      "event_id": "EVT-009",
      "run_id": "RUN-BARGE-001",
      "case_id": "BARGE-001",
      "turn_id": "turn_2",
      "response_id": "new",
      "type": "device_speech_start",
      "start_ms": 3900,
      "end_ms": 3900,
      "source": "manual_annotation",
      "observation_scope": "black_box",
      "confidence": 0.9,
      "evidence_ids": [
        "EVD-EVT-009"
      ]
    },
    {
      "schema_version": "2.0.0",
      "event_id": "EVT-010",
      "run_id": "RUN-BARGE-001",
      "case_id": "BARGE-001",
      "turn_id": "turn_2",
      "response_id": "new",
      "type": "device_speech_end",
      "start_ms": 5100,
      "end_ms": 5100,
      "source": "manual_annotation",
      "observation_scope": "black_box",
      "confidence": 0.9,
      "evidence_ids": [
        "EVD-EVT-010"
      ]
    }
  ]
}
